{
  "$schema": "https://json-schema.org/draft/2020-12/schema",
  "$id": "ul_lineage_graph.v1",
  "title": "UL Lineage Graph v1",
  "description": "Append-only DAG of governed runtime events for CISIV Operator Lineage Console.",
  "type": "object",
  "required": [
    "lineage_version",
    "graph_id",
    "mission_id",
    "nodes",
    "edges",
    "claim_label",
    "created_at_utc"
  ],
  "properties": {
    "lineage_version": { "const": "ul_lineage_graph.v1" },
    "graph_id": { "type": "string", "minLength": 1 },
    "mission_id": { "type": "string", "minLength": 1 },
    "session_id": { "type": "string" },
    "nodes": {
      "type": "array",
      "items": { "$ref": "#/$defs/lineage_node" }
    },
    "edges": {
      "type": "array",
      "items": { "$ref": "#/$defs/lineage_edge" }
    },
    "drift_status": {
      "type": "object",
      "properties": {
        "last_checked_utc": { "type": "string", "format": "date-time" },
        "passed": { "type": "boolean" },
        "failures": {
          "type": "array",
          "items": { "type": "string" }
        }
      },
      "additionalProperties": false
    },
    "claim_label": { "enum": ["asserted", "proven", "rejected"] },
    "created_at_utc": { "type": "string", "format": "date-time" },
    "updated_at_utc": { "type": "string", "format": "date-time" }
  },
  "$defs": {
    "lineage_node": {
      "type": "object",
      "required": [
        "node_id",
        "node_type",
        "timestamp_utc",
        "cisiv_stage"
      ],
      "properties": {
        "node_id": { "type": "string", "minLength": 1 },
        "node_type": {
          "enum": ["chat_turn", "memory_promotion", "capability_call", "forge_handoff"]
        },
        "timestamp_utc": { "type": "string", "format": "date-time" },
        "cisiv_stage": {
          "enum": ["concept", "identity", "structure", "implementation", "verification"]
        },
        "law_enforcement": { "type": "object" },
        "claim_label": { "enum": ["asserted", "proven", "rejected"] },
        "source_module": { "type": "string" },
        "payload_hash": { "type": "string" }
      },
      "additionalProperties": false
    },
    "lineage_edge": {
      "type": "object",
      "required": ["edge_id", "from_node_id", "to_node_id", "edge_type"],
      "properties": {
        "edge_id": { "type": "string", "minLength": 1 },
        "from_node_id": { "type": "string", "minLength": 1 },
        "to_node_id": { "type": "string", "minLength": 1 },
        "edge_type": { "enum": ["temporal", "causal"] },
        "drift_checked": { "type": "boolean", "default": false }
      },
      "additionalProperties": false
    }
  }
}
