{
  "lineage_version": "ul_lineage_graph.v1",
  "graph_id": "lineage-mission-fixture-001",
  "mission_id": "mission-fixture-001",
  "session_id": "session-fixture-001",
  "nodes": [
    {
      "node_id": "ln-chat-001",
      "node_type": "chat_turn",
      "timestamp_utc": "2026-06-02T12:00:00+00:00",
      "cisiv_stage": "verification",
      "claim_label": "proven",
      "source_module": "src.chat_turn_governance"
    },
    {
      "node_id": "ln-mem-001",
      "node_type": "memory_promotion",
      "timestamp_utc": "2026-06-02T12:01:00+00:00",
      "cisiv_stage": "structure",
      "claim_label": "asserted",
      "source_module": "src.jarvis_operator"
    },
    {
      "node_id": "ln-cap-001",
      "node_type": "capability_call",
      "timestamp_utc": "2026-06-02T12:02:00+00:00",
      "cisiv_stage": "implementation",
      "claim_label": "asserted",
      "source_module": "src.capability_service_bridge"
    },
    {
      "node_id": "ln-forge-001",
      "node_type": "forge_handoff",
      "timestamp_utc": "2026-06-02T12:03:00+00:00",
      "cisiv_stage": "implementation",
      "claim_label": "asserted",
      "source_module": "src.forge_repo_governance"
    }
  ],
  "edges": [
    {
      "edge_id": "le-001",
      "from_node_id": "ln-chat-001",
      "to_node_id": "ln-mem-001",
      "edge_type": "temporal",
      "drift_checked": true
    },
    {
      "edge_id": "le-002",
      "from_node_id": "ln-mem-001",
      "to_node_id": "ln-cap-001",
      "edge_type": "temporal",
      "drift_checked": true
    },
    {
      "edge_id": "le-003",
      "from_node_id": "ln-cap-001",
      "to_node_id": "ln-forge-001",
      "edge_type": "causal",
      "drift_checked": false
    }
  ],
  "drift_status": {
    "last_checked_utc": "2026-06-02T12:04:00+00:00",
    "passed": true,
    "failures": []
  },
  "claim_label": "asserted",
  "created_at_utc": "2026-06-02T12:00:00+00:00",
  "updated_at_utc": "2026-06-02T12:04:00+00:00"
}
